{
  "$schema": "http://json-schema.org/draft-03/schema",
  "required": false,
  "type": "object",
  "properties": {
    "key": {
      "required": false,
      "type": "string"
    },
    "raw_message": {
      "required": false,
      "type": "string"
    },
    "from_email": {
      "required": false,
      "type": "string"
    },
    "from_name": {
      "required": false,
      "type": "string"
    },
    "to": {
      "required": false,
      "type": "array",
      "items": {
        "required": false,
        "type": "string"
      }
    },
    "async": {
      "required": false,
      "type": "boolean"
    },
    "ip_pool": {
      "required": false,
      "type": "string"
    },
    "send_at": {
      "required": false,
      "type": "string"
    },
    "return_path_domain": {
      "required": false,
      "type": "null"
    }
  }
}